{
  "$schema": "sparql-test-cases.schema.json",
  "manifest_schema_version": "1.0.0",
  "suite": {
    "id": "phase-06-sparql",
    "validator": "rdflib-sparql"
  },
  "authority_refs": {
    "release_manifest": "C_Semantic_Treehouse/manifests/release-manifest.json",
    "baseline_test_cases": "C_Semantic_Treehouse/manifests/baseline-test-cases.json",
    "requirements": "C_Semantic_Treehouse/manifests/v0.4-requirements.json",
    "v0_4_test_cases": "C_Semantic_Treehouse/manifests/v0.4-test-cases.json",
    "validation_suites": "C_Semantic_Treehouse/manifests/validation-suites.json"
  },
  "required_query_ids": [
    "sparql-cq01-dataset-id",
    "sparql-cq02-provider",
    "sparql-cq03-endpoint",
    "sparql-cq04-format-frequency",
    "sparql-cq05-unit",
    "sparql-cq06-coverage",
    "sparql-cq07-conforms-to",
    "sparql-cq08-record-fields",
    "sparql-v04-cq09-dataset-count",
    "sparql-v04-cq10-dataset-node-iri",
    "sparql-v04-cq11-core-metadata",
    "sparql-v04-cq12-distribution-values",
    "sparql-v04-cq13-temporal-values",
    "sparql-v04-cq14-temporal-order",
    "sparql-v04-cq15-optional-fields",
    "sparql-v04-cq16-profile-version-binding",
    "sparql-v04-cq17-named-shapes",
    "sparql-v04-cq18-constraint-components",
    "sparql-v04-cq19-closed-shape-inventory",
    "sparql-v04-cq20-inherited-record-contract"
  ],
  "artifacts": [
    {"id": "cq01-query", "release": "v0.3", "kind": "sparql-query", "path": "C_Semantic_Treehouse/tests/sparql/queries/cq01-dataset-id.rq", "sha256": "7964d1ba924602d827beb5c1cbe7c8c7af7331520cf76c87d7aefa5ffe86c9e4"},
    {"id": "cq01-expected", "release": "v0.3", "kind": "expected-tsv", "path": "C_Semantic_Treehouse/tests/sparql/expected/cq01-dataset-id.tsv", "sha256": "48d4acfe26a34b362d5ba5670b8f35b34fbdd7cf71ad2e8f0facec694957c17d"},
    {"id": "cq02-query", "release": "v0.3", "kind": "sparql-query", "path": "C_Semantic_Treehouse/tests/sparql/queries/cq02-provider.rq", "sha256": "0b468d38158039ba2fff4083d7d6df021425cbb02410ac75a23f6e9ca9be747a"},
    {"id": "cq02-expected", "release": "v0.3", "kind": "expected-tsv", "path": "C_Semantic_Treehouse/tests/sparql/expected/cq02-provider.tsv", "sha256": "1dc6bbceaf5e4d09f9192613f299552b82295dd34edbd24c662b601ab9742de2"},
    {"id": "cq03-query", "release": "v0.3", "kind": "sparql-query", "path": "C_Semantic_Treehouse/tests/sparql/queries/cq03-endpoint.rq", "sha256": "ccac37c49f83a4b5608af465a8f62df4a24d0295fe8f71322b99e15384188584"},
    {"id": "cq03-expected", "release": "v0.3", "kind": "expected-tsv", "path": "C_Semantic_Treehouse/tests/sparql/expected/cq03-endpoint.tsv", "sha256": "69bacd4ad88ecb0066def483a8f778cd652a1d0dddf2e343195c198557120b51"},
    {"id": "cq04-query", "release": "v0.3", "kind": "sparql-query", "path": "C_Semantic_Treehouse/tests/sparql/queries/cq04-format-frequency.rq", "sha256": "f5f88522cd4509acb0ebd7402833fb9f9d181d5773de492e48724ba5fa21c539"},
    {"id": "cq04-expected", "release": "v0.3", "kind": "expected-tsv", "path": "C_Semantic_Treehouse/tests/sparql/expected/cq04-format-frequency.tsv", "sha256": "c5c13dc9d6eb801fe4c3b46a8daa0bc6b1e553324e6e5872fa4d8c1e6348b526"},
    {"id": "cq05-query", "release": "v0.3", "kind": "sparql-query", "path": "C_Semantic_Treehouse/tests/sparql/queries/cq05-unit.rq", "sha256": "ce92a6d39530488b73dde4a7103b35078bdf0421a3769e4812e86923f80cdaff"},
    {"id": "cq05-expected", "release": "v0.3", "kind": "expected-tsv", "path": "C_Semantic_Treehouse/tests/sparql/expected/cq05-unit.tsv", "sha256": "c5a3d03175d27f556f2a478dd22ece03c110ee5798a3a541edf94b5b7727ae51"},
    {"id": "cq06-query", "release": "v0.3", "kind": "sparql-query", "path": "C_Semantic_Treehouse/tests/sparql/queries/cq06-coverage.rq", "sha256": "fc4ef70bb3ac15d6b8a5ee3ecc9e72eddca1adae6706c941712228c0c84d1670"},
    {"id": "cq06-expected", "release": "v0.3", "kind": "expected-tsv", "path": "C_Semantic_Treehouse/tests/sparql/expected/cq06-coverage.tsv", "sha256": "137e0beb4bfb8f24f207a454e1eec0d724ec9faf65df1d90591beab811c57a34"},
    {"id": "cq07-query", "release": "v0.3", "kind": "sparql-query", "path": "C_Semantic_Treehouse/tests/sparql/queries/cq07-conforms-to.rq", "sha256": "d9c73ec6f6e83295be47c908146ce9770b484fb24e2520c1381dc7639e0e1cfe"},
    {"id": "cq07-expected", "release": "v0.3", "kind": "expected-tsv", "path": "C_Semantic_Treehouse/tests/sparql/expected/cq07-conforms-to.tsv", "sha256": "1b85c26bcc6c64153ee5eb323667594d61ef3c1413ba01564a3c6ae8db5cba08"},
    {"id": "cq08-query", "release": "v0.3", "kind": "sparql-query", "path": "C_Semantic_Treehouse/tests/sparql/queries/cq08-record-fields.rq", "sha256": "2111de056c7f7303821ef11012b8e246eb857b187a54c8ff07df6ba66788531b"},
    {"id": "cq08-expected", "release": "v0.3", "kind": "expected-tsv", "path": "C_Semantic_Treehouse/tests/sparql/expected/cq08-record-fields.tsv", "sha256": "b023b694a37bd01d0b8b8402f258326448b745373b12b53d9369de6046c6294a"},
    {"id": "v04-cq09-query", "release": "v0.4", "kind": "sparql-query", "path": "C_Semantic_Treehouse/tests/sparql/v0.4/queries/cq09-dataset-count.rq", "sha256": "8e934325749212c6810e368e4ce7ddb49b62f8e3dc3da28334f3a192ac19ce1a"},
    {"id": "v04-cq09-expected", "release": "v0.4", "kind": "expected-integer", "path": "C_Semantic_Treehouse/tests/sparql/v0.4/expected/cq09-dataset-count.txt", "sha256": "4355a46b19d348dc2f57c046f8ef63d4538ebb936000f3c9ee954a27460dd865"},
    {"id": "v04-cq10-query", "release": "v0.4", "kind": "sparql-query", "path": "C_Semantic_Treehouse/tests/sparql/v0.4/queries/cq10-dataset-node-iri.rq", "sha256": "c53e98017612b0c5a8f9a13f0c65d3d8f2c9557b64f3a800908b078676458b14"},
    {"id": "v04-cq10-expected", "release": "v0.4", "kind": "expected-boolean", "path": "C_Semantic_Treehouse/tests/sparql/v0.4/expected/cq10-dataset-node-iri.txt", "sha256": "a17fcf0a2f50e2d495e4f90ce263410edc183add6c62699a2facbccf60410f74"},
    {"id": "v04-cq11-query", "release": "v0.4", "kind": "sparql-query", "path": "C_Semantic_Treehouse/tests/sparql/v0.4/queries/cq11-core-metadata.rq", "sha256": "f93b2e8a315ae6476e25a56623a3257ca8861965025babba623bc36ee1e5caa7"},
    {"id": "v04-cq11-expected", "release": "v0.4", "kind": "expected-tsv", "path": "C_Semantic_Treehouse/tests/sparql/v0.4/expected/cq11-core-metadata.tsv", "sha256": "0e3e427061fad687df680af381d9df67d89e847002b9955e1d91ecc6fb3e6a17"},
    {"id": "v04-cq12-query", "release": "v0.4", "kind": "sparql-query", "path": "C_Semantic_Treehouse/tests/sparql/v0.4/queries/cq12-distribution-values.rq", "sha256": "b0a2a7b82b01be2549d6bbd9670f9f5011d029ca863be05ca3498d4a7bb2bf8e"},
    {"id": "v04-cq12-expected", "release": "v0.4", "kind": "expected-tsv", "path": "C_Semantic_Treehouse/tests/sparql/v0.4/expected/cq12-distribution-values.tsv", "sha256": "07345fedb2bfbdc787f4ac7357fee9c1dca6b48f39def34804269b4b7d091204"},
    {"id": "v04-cq13-query", "release": "v0.4", "kind": "sparql-query", "path": "C_Semantic_Treehouse/tests/sparql/v0.4/queries/cq13-temporal-values.rq", "sha256": "8f261d5af8e4d6cc5044117e5322ce51d217f68787b9878ffecb417d91240466"},
    {"id": "v04-cq13-expected", "release": "v0.4", "kind": "expected-tsv", "path": "C_Semantic_Treehouse/tests/sparql/v0.4/expected/cq13-temporal-values.tsv", "sha256": "4b479462cb96f07e7d520cf3d6a49abb91203338dbb144f2bc8a70c430a9b555"},
    {"id": "v04-cq14-query", "release": "v0.4", "kind": "sparql-query", "path": "C_Semantic_Treehouse/tests/sparql/v0.4/queries/cq14-temporal-order.rq", "sha256": "de526f51c26f8cbd8e6a7c035d59370b2dd7c24bcea80854fb7861665aa72d0c"},
    {"id": "v04-cq14-expected", "release": "v0.4", "kind": "expected-boolean", "path": "C_Semantic_Treehouse/tests/sparql/v0.4/expected/cq14-temporal-order.txt", "sha256": "a17fcf0a2f50e2d495e4f90ce263410edc183add6c62699a2facbccf60410f74"},
    {"id": "v04-cq15-query", "release": "v0.4", "kind": "sparql-query", "path": "C_Semantic_Treehouse/tests/sparql/v0.4/queries/cq15-optional-fields.rq", "sha256": "ae06aa6c60a6ea9d9044d6b0d20221d339b6806932e9c51b36da4e53f018f04f"},
    {"id": "v04-cq15-expected", "release": "v0.4", "kind": "expected-boolean", "path": "C_Semantic_Treehouse/tests/sparql/v0.4/expected/cq15-optional-fields.txt", "sha256": "a17fcf0a2f50e2d495e4f90ce263410edc183add6c62699a2facbccf60410f74"},
    {"id": "v04-cq16-query", "release": "v0.4", "kind": "sparql-query", "path": "C_Semantic_Treehouse/tests/sparql/v0.4/queries/cq16-profile-version-binding.rq", "sha256": "862a851757b6f3e5dc2681de345261b73192f1dd6ec6b52416ae5856e9d43c86"},
    {"id": "v04-cq16-expected", "release": "v0.4", "kind": "expected-boolean", "path": "C_Semantic_Treehouse/tests/sparql/v0.4/expected/cq16-profile-version-binding.txt", "sha256": "a17fcf0a2f50e2d495e4f90ce263410edc183add6c62699a2facbccf60410f74"},
    {"id": "v04-cq17-query", "release": "v0.4", "kind": "sparql-query", "path": "C_Semantic_Treehouse/tests/sparql/v0.4/queries/cq17-named-shapes.rq", "sha256": "f52592a0667eb7528d498332004b5e0d45823e1199e0ad9948cb8b67d0f31e90"},
    {"id": "v04-cq17-expected", "release": "v0.4", "kind": "expected-tsv", "path": "C_Semantic_Treehouse/tests/sparql/v0.4/expected/cq17-named-shapes.tsv", "sha256": "10fa26a584cb04345672841f6d173bef2260cbbec34c50328493a2d2c9001242"},
    {"id": "v04-cq18-query", "release": "v0.4", "kind": "sparql-query", "path": "C_Semantic_Treehouse/tests/sparql/v0.4/queries/cq18-constraint-components.rq", "sha256": "4c0933d6b3496f0cffdfe4aebcc34046a19eb7888e80d05c0a67548ee1ef9ac6"},
    {"id": "v04-cq18-expected", "release": "v0.4", "kind": "expected-tsv", "path": "C_Semantic_Treehouse/tests/sparql/v0.4/expected/cq18-constraint-components.tsv", "sha256": "d8c7c1f36e5dfa59207eaa4bc1646adf3f5ba604ce2a9da58c9c1718a87e20b5"},
    {"id": "v04-cq19-query", "release": "v0.4", "kind": "sparql-query", "path": "C_Semantic_Treehouse/tests/sparql/v0.4/queries/cq19-closed-shape-inventory.rq", "sha256": "84330ba9e1a2c61b9a66323080ff669ed91c22d4e2a366bdc337d2c33981040d"},